carpeta,archivo,ruta,anio,tipo_acto,subtipo,vigente_ccyc,variables_detectadas,calidad_preset,observaciones,usar_como_preset
ESCRIBANIA,2021 - ENTRADAS DE ESCRITURAS AL REGISTRO.docx,C:\Users\Florencia Martinez\Downloads\ESCRIBANIA-20251111T135947Z-1-001\ESCRIBANIA\2021 - ENTRADAS DE ESCRITURAS AL REGISTRO.docx,2022,Acta de ingreso notarial,,False,"fecha_ingreso, numero_entrada, numero_expediente",baja,"Documento incompleto: solo contiene datos administrativos de ingreso sin información sustantiva del acto notarial. No identifica naturaleza, partes, otorgantes ni cuerpo del instrumento.",no
2018 - DALVIAN S.A. - VITALE MARIN,2018 PERMUTA - DALVIAN SA - VITALE MARIN (20 JULIO 2018).docx,C:\Users\Florencia Martinez\Downloads\ESCRIBANIA-20251111T135947Z-1-001\ESCRIBANIA\2018 - DALVIAN S.A. - VITALE MARIN\2018 PERMUTA - DALVIAN SA - VITALE MARIN (20 JULIO 2018).docx,sin_fecha,Permuta de inmueble,entre persona física y sociedad anónima,True,"nombre_parte1, dni_parte1, cuit_parte1, fecha_nacimiento_parte1, estado_civil_parte1, domicilio_parte1, nombre_parte2, dni_parte2, cuit_parte2, fecha_nacimiento_parte2, estado_civil_parte2, domicilio_parte2, denominacion_sociedad, cuit_sociedad, domicilio_sociedad, cargo_representante, numero_escritura, fecha_escritura, ciudad, provincia, notario, registro_notarial",media,"El documento está vigente al CCyC 2015 (cita art. 306). Requiere especificar los inmuebles objeto de permuta con descripción técnica completa, linderos y datos registrales; falta cláusula de garantía de evicción y vicios ocultos conforme CCyC art. 2056-2059.",si
2018 - ESCRITURAS VILA -VILA (JUNIO 2018),2018 - VENTA - ALVS  a favor de DEV (JUNIO 2018) (ESC. Nº 144) 3.docx,C:\Users\Florencia Martinez\Downloads\ESCRIBANIA-20251111T135947Z-1-001\ESCRIBANIA\2018 - ESCRITURAS VILA -VILA (JUNIO 2018)\2018 - VENTA - ALVS  a favor de DEV (JUNIO 2018) (ESC. Nº 144) 3.docx,sin_fecha,Compraventa de inmueble,De bien inmueble rural (fracción indivisa),True,"nombre_vendedor, dni_vendedor, cuit_vendedor, fecha_nacimiento_vendedor, domicilio_vendedor, nombre_comprador, dni_comprador, cuit_comprador, fecha_nacimiento_comprador, domicilio_comprador, nombre_apoderado, dni_apoderado, numero_escritura_poder, fecha_poder, numero_registro_mandatos, ubicacion_inmueble, porcentaje_propiedad, precio_venta, condiciones_pago",media,"El documento está incompleto (se corta en la descripción del inmueble). Requiere completar: descripción del bien, precio, forma de pago, cláusulas finales y cierre notarial. Utiliza correctamente referencias al CCyC 2015 (art. 306).",si
2021 - ARCHIVOS DALVIAN - CANO,DECLARATORIA  - BEATRIZ CANO.docx,C:\Users\Florencia Martinez\Downloads\ESCRIBANIA-20251111T135947Z-1-001\ESCRIBANIA\2021 - ARCHIVOS DALVIAN - CANO\DECLARATORIA  - BEATRIZ CANO.docx,2019,Sentencia judicial - Declaratoria de herederos,Sucesión ab intestato,True,"nombre_causante, fecha_defuncion_causante, nombre_conyuge_anterior, fecha_divorcio, fecha_defuncion_conyuge, nombres_herederos, fechas_nacimiento_herederos, numero_expediente, fecha_sentencia, nombre_juez, numero_juzgado, provincia_registro_civil",baja,"Este es un documento judicial (sentencia), no un acto notarial. No es susceptible de ser utilizado como plantilla notarial estándar ni requiere análisis bajo criterios de protocolo notarial.",no
2021 - DALVIAN SA - CENTRO COMERCIAL,2021 - VENTA - VILA DANIEL - FINCA GROWINE (14 DIC. 2021).docx,C:\Users\Florencia Martinez\Downloads\ESCRIBANIA-20251111T135947Z-1-001\ESCRIBANIA\2021 - DALVIAN SA - CENTRO COMERCIAL\2021 - VENTA - VILA DANIEL - FINCA GROWINE (14 DIC. 2021).docx,sin_fecha,Compraventa de inmueble,de propiedad urbana (lote/terreno residencial),True,"nombre_vendedor, dni_vendedor, cuil_vendedor, fecha_nacimiento_vendedor, domicilio_vendedor, nombre_comprador, razon_social_comprador, cuit_comprador, domicilio_comprador, apoderado_vendedor, apoderado_comprador, numero_escritura, fecha_escritura, numero_poder_especial, descripcion_inmueble",media,"El documento está incompleto (corta en la acreditación de poder del apoderado de la SA). Necesita: descripción completa del inmueble (datos catastrales), monto de la operación, transmisión de dominio conforme art. 1892 CCyC, y completar la documentación de la persona jurídica compradora.",si
2021 - DUMIT - DALVIAN SA (1 DIC. 2021),PODER ESPECIAL IRREVOCABLE - CESION DERECHOS INMUEBLES (MARILEN DUMIT).docx,C:\Users\Florencia Martinez\Downloads\ESCRIBANIA-20251111T135947Z-1-001\ESCRIBANIA\2021 - DUMIT - DALVIAN SA (1 DIC. 2021)\PODER ESPECIAL IRREVOCABLE - CESION DERECHOS INMUEBLES (MARILEN DUMIT).docx,sin_fecha,Poder especial,Para transmitir inmuebles rurales (reconocimiento de posesión con obligación de transmitir),True,"nombre_otorgante, dni_otorgante, cuit_otorgante, fecha_nacimiento_otorgante, domicilio_otorgante, nombre_apoderado, dni_apoderado, cuit_apoderado, fecha_nacimiento_apoderado, domicilio_apoderado, numero_escritura, fecha_escritura, notario_nombre, registro_notarial, sentencia_numero, tribunal, descripcion_inmuebles, matriculas_registrales, superficies, porcentajes_propiedad",media,"El documento está incompleto (corta abruptamente en la descripción del tercer inmueble). Requiere completar la descripción catastral y las cláusulas de alcance del poder, obligaciones y revocabilidad conforme CCyC art. 375-377.",si
2022 - ARCHIVOS DUMIT (JUNIO 2022),PERMUTA 6000 X 53HAS.docx,C:\Users\Florencia Martinez\Downloads\ESCRIBANIA-20251111T135947Z-1-001\ESCRIBANIA\2022 - ARCHIVOS DUMIT (JUNIO 2022)\PERMUTA 6000 X 53HAS.docx,2022,Permuta de bienes inmuebles,Permuta de inmueble rural por lotes urbanos en condominio,True,"día y mes, nombres de comparecientes, números de DNI, domicilios, matrícula inmueble, superficie del inmueble, cantidad de lotes, ubicación de lotes, CUIT empresa, nombre representante legal",media,"El documento está incompleto (se corta en 'Sector IV'). Requiere: completar identificación de todos los lotes, especificar obligaciones de ambas partes respecto a escrituración y plazos, aclarar quién pagará gastos notariales e impuestos, y detallar condiciones de entrega.",si
A-ARCHIVOS RUBIO (ANTICIPO),2019 - PERMUTA - RICARDO Y ENRIQUE RUBIO (MAYO 2019).docx,C:\Users\Florencia Martinez\Downloads\ESCRIBANIA-20251111T135947Z-1-001\ESCRIBANIA\A-ARCHIVOS RUBIO (ANTICIPO)\2019 - PERMUTA - RICARDO Y ENRIQUE RUBIO (MAYO 2019).docx,2019,Permuta de inmuebles,Permuta de dos inmuebles rurales en condominio con asentimiento conyugal,True,"número_escritura, fecha_día, fecha_mes_año, nombre_notario, número_registro_notarial, nombre_primer_permutante, DNI_primer_permutante, CUIT_primer_permutante, fecha_nacimiento_primer_permutante, estado_civil_primer_permutante, domicilio_primer_permutante, nombre_segundo_permutante, DNI_segundo_permutante, CUIT_segundo_permutante, fecha_nacimiento_segundo_permutante, estado_civil_segundo_permutante, nombre_cónyuge_segundo_permutante, DNI_cónyuge, CUIT_cónyuge, domicilio_segundo_permutante, descripción_inmueble_1_distrito, descripción_inmueble_1_departamento, descripción_inmueble_1_superficie_título, descripción_inmueble_1_superficie_catastro, nombre_agrimensor, número_archivo_catastro, medidas_perimetrales_inmueble_1, descripción_inmueble_2",media,"El documento está incompleto (se corta en la descripción del segundo inmueble). Requiere completar la descripción íntegra del segundo inmueble, las obligaciones de los permutantes, plazos de entrega y cláusulas finales para ser utilizable. Referencias correctas al CCyC vigente.",si
ABRAHAM,2021 - TRANSF. DE LA PROPIEDAD FIDUCIARIA - FIDEIC. LOS TRILLIZOS - GABRIEL GUTIERREZ (FIDUCIARIO) (27 MAYO 2021).docx,C:\Users\Florencia Martinez\Downloads\ESCRIBANIA-20251111T135947Z-1-001\ESCRIBANIA\ABRAHAM\2021 - TRANSF. DE LA PROPIEDAD FIDUCIARIA - FIDEIC. LOS TRILLIZOS - GABRIEL GUTIERREZ (FIDUCIARIO) (27 MAYO 2021).docx,2020,Transferencia de propiedad fiduciaria,En cumplimiento de contrato de fideicomiso de administración,True,"nombre_fiduciante, dni_fiduciante, cuit_fiduciante, fecha_nacimiento_fiduciante, domicilio_fiduciante, nombre_fiduciario, dni_fiduciario, cuil_fiduciario, fecha_nacimiento_fiduciario, domicilio_fiduciario, nombre_fideicomiso, numero_escritura_fideicomiso, fecha_documento, numero_escritura_actual, fojas_protocolo, descripcion_inmueble",media,"El documento está incompleto (se corta en la parte dispositiva). Requiere completar la descripción del inmueble, monto/valuación fiduciaria, cláusulas finales (otorgamiento, constancia de derechos, firma de partes y notario).",si
ACEPTACION DE COMPRA,ACEPTACION Y CESION -TREUQUIL-VUILLE.docx,C:\Users\Florencia Martinez\Downloads\ESCRIBANIA-20251111T135947Z-1-001\ESCRIBANIA\ACEPTACION DE COMPRA\ACEPTACION Y CESION -TREUQUIL-VUILLE.docx,sin_fecha,Cesión de derechos y acciones,Aceptación de compra de derechos sobre inmueble en proceso judicial,False,"número_escritura, día_mes_año, nombre_notario, registro_notarial, nombre_parte_1, dni_parte_1, domicilio_parte_1, nombre_parte_2, dni_parte_2, cuit_parte_2, domicilio_parte_2, razon_social_sociedad, domicilio_social, numero_inscripcion_sociedad, fecha_contrato_constitutivo, numero_escritura_cesion_anterior, fecha_cesion_anterior, escribano_anterior, registro_notarial_anterior, nombre_cedente_original, dni_cedente_original, cuit_cedente_original, numero_expediente, ubicacion_inmueble, matricula_propiedad, nomenclatura_catastral",baja,"Documento incompleto (corta abruptamente), con referencias al Código Civil de Vélez (art. 1.002) no vigente en CCyC. Requiere actualización integral de lenguaje, actualización de referencias normativas al CCyC 2015 y completitud del acto jurídico.",no
ACREDITA PERSONERIA JURIDICA,modelo_FRIMONT-2.docx,C:\Users\Florencia Martinez\Downloads\ESCRIBANIA-20251111T135947Z-1-001\ESCRIBANIA\ACREDITA PERSONERIA JURIDICA\modelo_FRIMONT-2.docx,sin_fecha,Certificación de existencia y vigencia de persona jurídica,"Para trámite ante Secretaría de Industria, Comercio y PYME",False,"nombre_escribano, numero_registro_notarial, fecha_documento, nombre_compareciente, dni_compareciente, cuit_compareciente, fecha_nacimiento_compareciente, domicilio_compareciente, cargo_compareciente, denominacion_sociedad, domicilio_legal_sociedad, numero_escritura_transformacion, fecha_transformacion, numero_escritura_constitucion, fecha_constitucion, numero_acta_asamblea, fecha_asamblea, cargo_designado",baja,"Documento de 2007, redactado bajo Código Civil de Vélez (referencias arts. 1.002). Requiere actualización integral a términos del CCyC 2015 (capacidad, representación, sociedades) y modernización de estructura acorde a resoluciones vigentes.",no
ACTA DE COMPROBACION,ACTA COMPROBACIÓN DE MENSAJE DE TEXTO EN EL TELEFONO DEL REQUIRENTE (DIC. 2014).docx,C:\Users\Florencia Martinez\Downloads\ESCRIBANIA-20251111T135947Z-1-001\ESCRIBANIA\ACTA DE COMPROBACION\ACTA COMPROBACIÓN DE MENSAJE DE TEXTO EN EL TELEFONO DEL REQUIRENTE (DIC. 2014).docx,sin_fecha,Acta de comprobación,Certificación de contenido de mensajes de texto en dispositivo móvil,False,"nombre_notario, numero_registro_notarial, fecha_acta, nombre_compareciente, dni_compareciente, cuit_compareciente, domicilio_compareciente, nombre_auxiliar, nombre_tercero_involucrado, numero_telefonico_origen, numero_telefonico_exhibido, marca_dispositivo, proveedor_servicio, horario_comprobacion, contenido_mensajes",baja,El documento utiliza referencias al Código Civil de Vélez (art. 1.002) en lugar del CCyC 2015. Requiere revisión normativa urgente sobre competencia notarial para certificar contenido digital y consentimiento de todas las partes involucradas; la metodología de comprobación carece de garantías de integridad técnica y cadena de custodia.,no
ACTA DE CONSTATACION,2020 - ACTA DE NOTIFICACION - RIO VIEJO SA (PARA ENVIAR A SAN LUIS) JULIO 2020 (TESTIMONIO).docx,C:\Users\Florencia Martinez\Downloads\ESCRIBANIA-20251111T135947Z-1-001\ESCRIBANIA\ACTA DE CONSTATACION\2020 - ACTA DE NOTIFICACION - RIO VIEJO SA (PARA ENVIAR A SAN LUIS) JULIO 2020 (TESTIMONIO).docx,2020,Acta de Requerimiento,Acreditación de representación de persona jurídica,True,"número_escritura, fecha_día, fecha_mes, fecha_año, nombre_notario, número_registro_notarial, nombre_persona_física, nacionalidad, dni, cuit_persona, fecha_nacimiento, estado_civil, domicilio_calle, domicilio_número, domicilio_distrito, domicilio_departamento, provincia, razón_social_empresa, cuit_empresa, domicilio_empresa_calle, domicilio_empresa_número, domicilio_empresa_piso, domicilio_empresa_oficina, cargo_representante, número_escritura_constitución, fecha_constitución, número_acta_subsanación, fecha_subsanación, notario_anterior, protocolo_anterior, resolución_dpj, fecha_resolución_dpj, número_sociedad_dpj, número_rpc, fecha_asamblea, fojas_asamblea, número_libro_actas, fecha_acta_directorio, fojas_directorio",media,"Documento incompleto al final. Incluye referencias al DNU 297/20 sobre COVID-19 que es histórico; actualizar según contexto actual. Referencias correctas al CCyC 2015 (arts. 306, 23, 44, 45).",si
ACTAS CIERRE DE PROTOCOLOS,NOTA ACOMPAÑA ACTAS DE CIERRE DEL PROTOCOLO 2019.docx,C:\Users\Florencia Martinez\Downloads\ESCRIBANIA-20251111T135947Z-1-001\ESCRIBANIA\ACTAS CIERRE DE PROTOCOLOS\NOTA ACOMPAÑA ACTAS DE CIERRE DEL PROTOCOLO 2019.docx,sin_fecha,Acta de cierre de protocolo notarial,Protocolos General y Auxiliar - año 2019,True,"nombre_notario, numero_registro, domicilio_notario, calle_numero, ciudad, fecha_documento, año_fiscal",media,Documento administrativo de carácter obligatorio. Requiere validación de estructura formal del acta adjunta y verificación de cumplimiento de requisitos de cierre según normativa notarial provincial mendocina.,si
ACTAS COMPLEMENTARIAS,2019-ACTA COMPLEMENTARIA - SINCERAMIENTO - BERTOLDO - STONE (FEB. 2019).docx,C:\Users\Florencia Martinez\Downloads\ESCRIBANIA-20251111T135947Z-1-001\ESCRIBANIA\ACTAS COMPLEMENTARIAS\2019-ACTA COMPLEMENTARIA - SINCERAMIENTO - BERTOLDO - STONE (FEB. 2019).docx,2018,Acta Complementaria de Transmisión de Dominio,Sinceramiento Fiscal - Ley 27.260 (Fideicomiso),True,"nombre_fiduciario, dni_fiduciario, cuit_fiduciario, fecha_nacimiento_fiduciario, estado_civil_fiduciario, domicilio_fiduciario, nombre_adquirente_1, dni_adquirente_1, cuit_adquirente_1, fecha_nacimiento_adquirente_1, nombre_adquirente_2, dni_adquirente_2, cuit_adquirente_2, fecha_nacimiento_adquirente_2, domicilio_adquirentes, numero_escritura_original, fecha_escritura_original, numero_registro_notarial, numero_protocolo, numero_fojas, nombre_notario, fecha_acta, numero_fideicomiso, numero_escritura_fideicomiso, fecha_escritura_fideicomiso",media,"Documento incompleto (truncado al final), pero utiliza lenguaje y referencias del CCyC 2015 (art. 306). Requiere completarse la parte final del acta y verificar que contenga la cláusula dispositiva completa sobre la transmisión de dominio.",si
ACTAS DE MANIFESTACION,2021 - ACTA DE MANIFESTACION - VINCI (JULIO 2021).docx,C:\Users\Florencia Martinez\Downloads\ESCRIBANIA-20251111T135947Z-1-001\ESCRIBANIA\ACTAS DE MANIFESTACION\2021 - ACTA DE MANIFESTACION - VINCI (JULIO 2021).docx,2020,Acta de Manifestación - Renuncia de derechos hereditarios,Renuncia a derechos derivados de reconocimiento de anticipo de herencia,True,"nombre_compareciente_1, dni_compareciente_1, cuit_compareciente_1, fecha_nacimiento_1, domicilio_1, nombre_compareciente_2, dni_compareciente_2, cuit_compareciente_2, fecha_nacimiento_2, domicilio_2, numero_escritura_anterior, fecha_escritura_anterior, nombre_otorgante_anterior, descripcion_inmueble, ubicacion_inmueble, provincia_inmueble, numero_notario, nombre_notario, fecha_acta, protocolo_numero",media,Documento incompleto: falta la conclusión de la cláusula II y posible falta de firmas. Verificar que conste la aceptación de la renuncia conforme arts. 2281 y ss. CCyC.,si
ACTAS DE NOTIFICACION,2021 - ACTA DE NOTIFICACION - SAUDA S.R.L. (SEPT. 2021).docx,C:\Users\Florencia Martinez\Downloads\ESCRIBANIA-20251111T135947Z-1-001\ESCRIBANIA\ACTAS DE NOTIFICACION\2021 - ACTA DE NOTIFICACION - SAUDA S.R.L. (SEPT. 2021).docx,2021,Acta de Notificación,Notificación de incumplimiento contractual en contexto de subasta fiduciaria,True,"nombre_notario, registro_notarial, fecha_acta, nombre_compareciente, dni_compareciente, cuit_compareciente, fecha_nacimiento, estado_familia, profesion, domicilio_legal, nombre_representada, cuit_representada, domicilio_representada, fecha_contrato_social, fechas_modificaciones, fojas_legajo, numero_legajo, numero_poder, fecha_poder, notario_poder, registro_notarial_poder, fojas_registro_mandatos, tomo_registro, nombre_notificado, domicilio_notificado, fecha_subasta, monto_subasta, descripcion_bienes",media,"El documento está incompleto (se corta en la narración de hechos). Contiene referencias válidas al CCyC 2015 (art. 306, 23, 44, 45) pero requiere completar la descripción de los bienes y el texto de la notificación antes de usarse como preset.",si
ACTAS DE REQUERIMIENTO,2020 - ACTA DE NOTIFICACION - RIO VIEJO SA (FRIMA ETCHEPARE) 31 JULIO 2020.docx,C:\Users\Florencia Martinez\Downloads\ESCRIBANIA-20251111T135947Z-1-001\ESCRIBANIA\ACTAS DE REQUERIMIENTO\2020 - ACTA DE NOTIFICACION - RIO VIEJO SA (FRIMA ETCHEPARE) 31 JULIO 2020.docx,2020,Acta de Requerimiento,Actuación en representación de sociedad anónima,True,"nombre_notario, numero_registro_notarial, fecha_acto, nombre_compareciente, dni_compareciente, cuit_compareciente, fecha_nacimiento, estado_civil, domicilio_compareciente, nombre_sociedad, cuit_sociedad, domicilio_social, numero_escritura_constitucion, fecha_escritura_constitucion, notario_constitucion, numero_resolucion_dpj, numero_sociedad_dpj, numero_rpc, numero_escritura_poder, fecha_escritura_poder",media,"Documento incompleto (se corta en el apartado de expresiones). Requiere revisión de redacción en la sección de identidad (repetición de 'justifica'), y completar el cuerpo del acta con las manifestaciones y petitorio final.",si
ACTAS DE SUBSANACION,TRIZ Bureau-Acta de Subsanacion Estatuto Socia(SARALEGUI) ABRIL 2011.docx,C:\Users\Florencia Martinez\Downloads\ESCRIBANIA-20251111T135947Z-1-001\ESCRIBANIA\ACTAS DE SUBSANACION\TRIZ Bureau-Acta de Subsanacion Estatuto Socia(SARALEGUI) ABRIL 2011.docx,sin_fecha,Acta de Subsanación de Sociedad Anónima,Aumento de capital social,False,"nombre_notario, numero_registro_notarial, fecha_acto, nombre_compareciente_1, dni_compareciente_1, cuit_compareciente_1, edad_compareciente_1, domicilio_compareciente_1, nombre_compareciente_2, dni_compareciente_2, cuit_compareciente_2, edad_compareciente_2, domicilio_compareciente_2, nombre_compareciente_3, dni_compareciente_3, cuit_compareciente_3, edad_compareciente_3, domicilio_compareciente_3, nombre_entidad, numero_expediente, monto_capital_social, cantidad_acciones, valor_nominal_accion, votos_por_accion, acciones_compareciente_1, monto_suscripcion_compareciente_1, acciones_compareciente_2, monto_suscripcion_compareciente_2, acciones_compareciente_3, monto_suscripcion_compareciente_3, porcentaje_integrado, monto_integrado, plazo_integracion, numero_escritura",baja,"El documento utiliza referencias al Código Civil de Vélez (art. 1.002) y Ley 19.550, sin aplicar el lenguaje del CCyC 2015. Además, el documento está incompleto (corte abrupto en la última línea con 'respectivame'), requiere revisión integral y actualización normativa.",no
ACTAS RECTIFICATORIAS,ACTA RECTIFICACION TORNESI.docx,C:\Users\Florencia Martinez\Downloads\ESCRIBANIA-20251111T135947Z-1-001\ESCRIBANIA\ACTAS RECTIFICATORIAS\ACTA RECTIFICACION TORNESI.docx,sin_fecha,Acta de Rectificación,de error en estado civil en escritura de rescisión de venta,False,"nombre_propietario_original, nombre_beneficiario, numero_escritura_original, fecha_escritura_original, folio_protocolo, numero_registro_notarial, nombre_notario, fecha_acta, estado_civil_correcto, nombre_conyuge, matricula_inmueble, asiento_folio_real, error_consignado",baja,Documento de 2005 con lenguaje y estructuras previas al CCyC 2015; contiene referencias a Folio Real (sistema mendocino derogado) y redacción antigua. Requiere adaptación completa al actual CCyC y sistema de registración vigente.,no
ACTAS VARIAS,GUARDA HABITUAL DE RUTH PACHECO (guarda habitual) 2014.docx,C:\Users\Florencia Martinez\Downloads\ESCRIBANIA-20251111T135947Z-1-001\ESCRIBANIA\ACTAS VARIAS\GUARDA HABITUAL DE RUTH PACHECO (guarda habitual) 2014.docx,sin_fecha,Declaración Jurada de Domicilio de Guarda Habitual,para vehículo automotor,False,"nombre_compareciente, dni_compareciente, estado_civil, domicilio_real_legal, fecha_nacimiento, marca_vehiculo, tipo_vehiculo, modelo_vehiculo, numero_motor, numero_chasis, dominio_vehiculo, domicilio_guarda_habitual, provincia_guarda_habitual, fecha_acta, nombre_notario, numero_registro_notarial",baja,"Documento redactado bajo Código Civil de Vélez (referencias al art. 1.002), no adaptado al CCyC 2015. Requiere actualización de terminología, estructura de cláusulas y referencias normativas antes de ser utilizado como modelo estándar.",no
ALBARRACIN  - ANTONACCI (2018),2018 - VENTA POR TRACTO - GUTIERREZ - ALBARRACIN (AGOSTO 2018).docx,C:\Users\Florencia Martinez\Downloads\ESCRIBANIA-20251111T135947Z-1-001\ESCRIBANIA\ALBARRACIN  - ANTONACCI (2018)\2018 - VENTA POR TRACTO - GUTIERREZ - ALBARRACIN (AGOSTO 2018).docx,sin_fecha,Compraventa de inmueble,de propiedad inmueble urbana con intervención de fiduciario y apoderado,True,"nombres_vendedores, dni_vendedores, cuit_vendedores, fechas_nacimiento_vendedores, estado_civil_vendedores, domicilios_vendedores, nombre_comprador, dni_comprador, cuit_comprador, fecha_nacimiento_comprador, domicilio_comprador, nombre_apoderado, dni_apoderado, cuit_apoderado, fecha_nacimiento_apoderado, domicilio_apoderado, representado_nombre, representado_dni, representado_cuit, representado_fecha_nacimiento, representado_estado_civil, representado_domicilio, numero_poder, fecha_poder, escribana_poder, registro_notarial_poder, numero_escritura, fecha_otorgamiento, notario, registro_notarial_presente, nombre_fideicomiso, descripcion_inmueble, precio_venta, forma_pago",media,"El documento está incompleto (termina abruptamente en 'I.- b'), falta especificar el inmueble, precio, forma de pago y cláusulas esenciales de la compraventa. Requiere revisión de domicilios inconsistentes entre comparecientes (dos domicilios diferentes para la misma persona).",si
ANTICIPO DE HERENCIA,2017 - ANTICIPO DE HERENCIA CON RESERVA DE USUFRUCTO - ZANETTI.docx,C:\Users\Florencia Martinez\Downloads\ESCRIBANIA-20251111T135947Z-1-001\ESCRIBANIA\ANTICIPO DE HERENCIA\2017 - ANTICIPO DE HERENCIA CON RESERVA DE USUFRUCTO - ZANETTI.docx,2022,Anticipo de herencia,Con reserva de usufructo y desafectación de régimen de protección de vivienda,True,"número_escritura, fecha_día, fecha_mes, fecha_año, nombre_notario, número_registro_notarial, nombre_escribano_titular, nombre_otorgante_1, dni_otorgante_1, cuit_otorgante_1, fecha_nacimiento_otorgante_1, nombre_otorgante_2, dni_otorgante_2, cuit_otorgante_2, fecha_nacimiento_otorgante_2, domicilio_otorgantes, nombre_beneficiario_1, dni_beneficiario_1, cuit_beneficiario_1, fecha_nacimiento_beneficiario_1, domicilio_beneficiario_1, nombre_beneficiario_2, dni_beneficiario_2, cuit_beneficiario_2, fecha_nacimiento_beneficiario_2, domicilio_beneficiario_2, nombre_beneficiario_3, dni_beneficiario_3, cuit_beneficiario_3, fecha_nacimiento_beneficiario_3, domicilio_beneficiario_3, descripción_bien_inmueble, porcentaje_anticipo",media,"El documento está incompleto (se corta en la parte dispositiva) y contiene errores tipográficos (""manfiestan"", ""1.99"" en fecha de nacimiento, espacios inconsistentes en domicilio otorgantes). Requiere completarse la cláusula dispositiva, especificar el inmueble transferido, porcentajes de herencia y detalles del usufructo reservado conforme CCyC arts. 2265-2269.",si
APORTE DE CAPITAL,APORTE CAPITAL PETRA-DOMINGUEZ.docx,C:\Users\Florencia Martinez\Downloads\ESCRIBANIA-20251111T135947Z-1-001\ESCRIBANIA\APORTE DE CAPITAL\APORTE CAPITAL PETRA-DOMINGUEZ.docx,sin_fecha,Aporte de capital a sociedad anónima,Transferencia de inmueble con edificio,False,"nombre_aportante, dni_aportante, cuit_aportante, domicilio_aportante, nombre_sociedad, cuit_sociedad, domicilio_sociedad, cargo_representante, numero_escritura_constitucion, fecha_constitucion, numero_escritura_subsanacion, fecha_subsanacion, descripcion_inmueble, superficie_titulo, superficie_catastro, ubicacion_inmueble, limites_perimetrales, numero_catastro, fecha_mensura",baja,"Documento de 2008 redactado bajo Código de Vélez. Requiere actualización integral a lenguaje y estructura del CCyC 2015 (capacidad, representación, obligaciones, derechos reales). Falta completar identificación de comparecientes y formalización final del acto.",no
ASENTIMIENTO CONYUGAL,CONSENTIMIENTO CONYUGAL-CHARIF.docx,C:\Users\Florencia Martinez\Downloads\ESCRIBANIA-20251111T135947Z-1-001\ESCRIBANIA\ASENTIMIENTO CONYUGAL\CONSENTIMIENTO CONYUGAL-CHARIF.docx,sin_fecha,Consentimiento conyugal,para compraventa de inmueble,False,"nombre_cónyuge_consintiente, dni_cónyuge_consintiente, nombre_cónyuge_obligado, dni_cónyuge_obligado, nombre_tercero_comprador, dni_tercero_comprador, ubicación_inmueble, número_calle, superficie_inmueble, matrícula_propiedad, folio_real, precio_venta, forma_pago, fecha, provincia",baja,"Documento redactado bajo Código de Vélez (art. 1.277), no utiliza lenguaje del CCyC 2015. Requiere actualización normativa completa: el CCyC elimina la figura del consentimiento conyugal previo y regula derechos en el régimen patrimonial matrimonial (arts. 446-475).",no
