carpeta,archivo,ruta,anio,tipo_acto,subtipo,vigente_ccyc,variables_detectadas,calidad_preset,observaciones,usar_como_preset
CESION - BNA - CACSA,CESION CACSA_BCO.NACION-CERVA FRIS (APODERADO) NOV. 2014.docx,C:\Users\Florencia Martinez\Downloads\ESCRIBANIA-20251111T135947Z-1-001\ESCRIBANIA\CESION - BNA - CACSA\CESION CACSA_BCO.NACION-CERVA FRIS (APODERADO) NOV. 2014.docx,2015,Cesión en Garantía,de derechos crediticios entre persona jurídica (CACSA) y banco,False,"nombre_empresa_deudor, nombre_banco_acreedor, nombre_apoderado_banco, DNI_apoderado_banco, estado_civil_apoderado_banco, domicilio_apoderado_banco, nombre_apoderado_empresa, DNI_apoderado_empresa, CUIT_apoderado_empresa, estado_civil_apoderado_empresa, domicilio_apoderado_empresa, CUIT_banco, CUIT_empresa, numero_escritura_poder_banco, fecha_poder_banco, escribano_poder_banco, numero_registro_poder, fecha_inscripcion_poder, numero_escritura_constitucion_empresa, fecha_constitucion_empresa, fecha_actual, ciudad, provincia",baja,"El documento está incompleto (corta abruptamente) y utiliza lenguaje anterior al CCyC 2015 (referencias a Código de Vélez, estructura formal anticuada). Requiere actualización integral a lenguaje vigente, completitud del acto y verificación de datos de mandatos actualizados.",no
CESION BCO. PATAGONIA - FACTURA ELECTRONICA,2019 - MODELO - Adelanto de Fondos c cesion de Facturas Credito Electronica. Nov.docx,C:\Users\Florencia Martinez\Downloads\ESCRIBANIA-20251111T135947Z-1-001\ESCRIBANIA\CESION BCO. PATAGONIA - FACTURA ELECTRONICA\2019 - MODELO - Adelanto de Fondos c cesion de Facturas Credito Electronica. Nov.docx,sin_fecha,Contrato de Adelanto de Fondos y Cesión de Derechos de Cobro,Cartera comercial/Factoring,True,"nombre_cliente, importe_adelanto, numero_cuenta_corriente, sucursal_banco, fecha_amortizacion, tasa_interes_nominal_anual, comision_instrumentacion, facturas_cedidas, deudores_facturas",media,"El documento usa lenguaje del CCyC pero es un contrato bancario (no notarial puro). Requiere completar cláusulas sobre cesión de derechos (garantías, notificación a deudores) y ajustar referencias a obligaciones accessorias conforme arts. 339-346 CCyC.",si
CESION BCO. PATAGONIA - HANDCAT,Modelo escritura de notifiación de cesión HANDCAT SA.docx,C:\Users\Florencia Martinez\Downloads\ESCRIBANIA-20251111T135947Z-1-001\ESCRIBANIA\CESION BCO. PATAGONIA - HANDCAT\Modelo escritura de notifiación de cesión HANDCAT SA.docx,2021,Acta de Notificación de Cesión en Garantía,de derechos de cobro derivados de contrato comercial,True,"fecha_acta (día, mes, año), nombre_apoderado, nombre_cedente, cuit_cedente, domicilio_cedente, nombre_cesionario, cuit_cesionario, domicilio_cesionario, tipo_contrato_cesion, numero_contrato_sap, fecha_contrato_original, tercero_obligado (YPF S.A.), vigencia_contrato, nombre_receptor_notificacion, domicilio_tercero_obligado",media,El documento contiene espacios sin completar (SEGUNDO punto requiere aclaración sobre modalidad de pagos) y referencias genéricas que necesitan especificación. Requiere revisión de cláusulas finales aparentemente incompletas (último párrafo corta abruptamente en 'compensar el derecho afectado'). Estructura acorde al CCyC pero debe completarse antes de uso.,si
CESION BCO. PATAGONIA-NUEVO MODELO(Cert.de obra)FEB.2010,MODELO CESION-Adelanto de Fondos-FEBRERO 2010.docx,C:\Users\Florencia Martinez\Downloads\ESCRIBANIA-20251111T135947Z-1-001\ESCRIBANIA\CESION BCO. PATAGONIA-NUEVO MODELO(Cert.de obra)FEB.2010\MODELO CESION-Adelanto de Fondos-FEBRERO 2010.docx,sin_fecha,Contrato de Adelanto de Fondos y Cesión de Derechos de Cobro,De Certificados de Obra,True,"nombre_deudor, importe_adelanto, numero_cuenta_corriente, sucursal_banco, fecha_amortizacion_dia, fecha_amortizacion_mes, fecha_amortizacion_año, tasa_interes_porcentaje, porcentaje_comision_estructuracion, dias_previo_notificacion_precancelacion",media,Documento incompleto (falta finalización de cláusula cuarta). Requiere integración de datos faltantes y revisión de cláusula vigésima referenciada (notificación de derechos de cobro). Lenguaje compatible con CCyC 2015.,si
CESION BCO.NACION-CARRERAS Y GUTIERREZ,CESION CARRERAS Y GUTIERREZ_BCO.NACION (OCT. 2015).docx,C:\Users\Florencia Martinez\Downloads\ESCRIBANIA-20251111T135947Z-1-001\ESCRIBANIA\CESION BCO.NACION-CARRERAS Y GUTIERREZ\CESION CARRERAS Y GUTIERREZ_BCO.NACION (OCT. 2015).docx,2016,Cesión en Garantía,de crédito bancario,True,"nombres_otorgantes, dni_otorgantes, cuit_sociedades, fechas_nacimiento, domicilios_otorgantes, numero_escritura, fecha_escritura, jurisdiccion_notarial, nombre_acreedor, nombre_deudor, referencia_poder_general, numero_protocolo_poder, fecha_poder, escribano_poder, numero_inscripcion_poder, objeto_cesion_garantia",media,"El documento está incompleto (corta al final en 'domicilio en Avenida Acceso Este...'). Requiere especificar claramente qué bienes/créditos se ceden en garantía, el monto del crédito garantizado y las cláusulas de ejecución según CCyC arts. 1609 y ss.",si
CESION BCO.PATAGONIA-ARNEXX,RESCISION DE CESION ARNEXX-BCO.PATAGONIA (NOV. 2012).docx,C:\Users\Florencia Martinez\Downloads\ESCRIBANIA-20251111T135947Z-1-001\ESCRIBANIA\CESION BCO.PATAGONIA-ARNEXX\RESCISION DE CESION ARNEXX-BCO.PATAGONIA (NOV. 2012).docx,sin_fecha,Rescisión de Adelanto de Fondos y Cesión de Factura,,False,"nombres_otorgantes, DNI_otorgantes, domicilios, denominacion_empresa, CUIT, fecha_escritura, numero_escritura, numero_protocolo, notario_actuante, registro_notarial, datos_poder_especial, datos_fusión_bancaria",baja,"Documento de 2012 utiliza referencias al Código Civil de Vélez (art. 1.002). Requiere actualización integral al CCYC 2015 en estructura, lenguaje y referencias normativas. El documento aparece incompleto (termina en 'test').",no
CESION BCO.PATAGONIA-BGP SA-EL HUERTO SA,BGP SA.-BCO. PATAGONIA(Adelanto de Fondos y Cesion de certificado) (MAYO 2014).docx,C:\Users\Florencia Martinez\Downloads\ESCRIBANIA-20251111T135947Z-1-001\ESCRIBANIA\CESION BCO.PATAGONIA-BGP SA-EL HUERTO SA\BGP SA.-BCO. PATAGONIA(Adelanto de Fondos y Cesion de certificado) (MAYO 2014).docx,sin_fecha,Adelanto de fondos y cesión de certificado,Operación bancaria entre sociedades anónimas,False,"nombre_apoderado_1, dni_apoderado_1, nombre_apoderado_2, dni_apoderado_2, domicilio_apoderados, nombre_banco_representado, cuit_banco, nombre_cedente, cuit_cedente, fecha_escritura, numero_escritura, numero_protocolo, numero_registro_notario, monto_adelanto, numero_certificado_cedido, fecha_poder_apoderados",media,"Documento de 2014 usa Código Civil de Vélez (referencia art. 1.002). Actualizar referencias normativas al CCyC 2015 (capacidad en art. 22 ss., representación en arts. 358-365). El acto es válido pero requiere modernización del lenguaje notarial.",no
CESION BCO.PATAGONIA-CALZETTA,CALZETTA -BCO. PATAGONIA(Adelanto de Fondos y Cesion de certificado) (OCT. 2013) IPV - FANTASIA-VALERI.docx,C:\Users\Florencia Martinez\Downloads\ESCRIBANIA-20251111T135947Z-1-001\ESCRIBANIA\CESION BCO.PATAGONIA-CALZETTA\CALZETTA -BCO. PATAGONIA(Adelanto de Fondos y Cesion de certificado) (OCT. 2013) IPV - FANTASIA-VALERI.docx,sin_fecha,Adelanto de fondos y cesión de certificado,Entre personas físicas y sociedad anónima (banco),False,"nombres_apoderados, dni_apoderados, nombre_otorgante, documento_otorgante, cuit_otorgante, domicilio_otorgante, razon_social_banco, cuit_banco, fecha_acto, numero_escritura, numero_protocolo, ciudad, provincia",baja,Documento incompleto (corte abrupto al final). Usa Código Civil de Vélez (art. 1.002) y lenguaje anterior a CCyC 2015; requiere actualización normativa integral y finalización del texto.,no
CESION BCO.PATAGONIA-CALZETTA IRON,IRON S.A. -BCO. PATAGONIA(Adelanto de Fondos y Cesion de certificado) (DIC. 2013) IPV - FANTASIA-VALERI.docx,C:\Users\Florencia Martinez\Downloads\ESCRIBANIA-20251111T135947Z-1-001\ESCRIBANIA\CESION BCO.PATAGONIA-CALZETTA IRON\IRON S.A. -BCO. PATAGONIA(Adelanto de Fondos y Cesion de certificado) (DIC. 2013) IPV - FANTASIA-VALERI.docx,sin_fecha,Adelanto de fondos y cesión de certificado,Entre persona física y sociedad anónima (banco),False,"nombre_otorgante_1, dni_otorgante_1, nombre_otorgante_2, dni_otorgante_2, domicilio_otorgantes, nombre_otorgante_3, dni_otorgante_3, cuit_otorgante_3, domicilio_otorgante_3, nombre_banco, cuit_banco, fecha_escritura, numero_escritura, numero_protocolo, numero_notario, ciudad_notarial, monto_adelanto, descripcion_certificado",baja,"Documento anterior al CCyC 2015 (redactado en 2013). Requiere actualización normativa integral al CCYC: revisar referencias al art. 1.002 CC (ahora art. 286 CCYC), incorporar capacidad jurídica según CCYC, y modernizar terminología de representación y poder.",no
CESION BCO.PATAGONIA-CEOSA,NOTA AUTORIZAR PAGO HONORARIOS (CEOSA) (MAYO 2017) ESC. 88.docx,C:\Users\Florencia Martinez\Downloads\ESCRIBANIA-20251111T135947Z-1-001\ESCRIBANIA\CESION BCO.PATAGONIA-CEOSA\NOTA AUTORIZAR PAGO HONORARIOS (CEOSA) (MAYO 2017) ESC. 88.docx,2017,Autorización de débito bancario,Para pago de honorarios escribaniles,True,"fecha_documento, nombre_banco, sucursal_banco, numero_cuenta_corriente, nombre_empresa, tipo_sociedad, domicilio_empresa, numero_factura, fecha_factura, monto_factura, numero_caja_ahorros_escribano, nombre_escribano, cbu, numero_escribania",media,"Documento funcional pero incompleto: faltan firma, aclaración y carácter del firmante. Modernizar redacción eliminando referencias a 'Esc. Nº' y usar lenguaje más directo acorde al CCyC.",si
CESION BCO.PATAGONIA-CLISA INTERIOR,CLISA INTERIOR -BCO. PATAGONIA(Adelanto de Fondos y Cesion de factura) (JUNIO 2015) SUC. GUTIERREZ (SAT).docx,C:\Users\Florencia Martinez\Downloads\ESCRIBANIA-20251111T135947Z-1-001\ESCRIBANIA\CESION BCO.PATAGONIA-CLISA INTERIOR\CLISA INTERIOR -BCO. PATAGONIA(Adelanto de Fondos y Cesion de factura) (JUNIO 2015) SUC. GUTIERREZ (SAT).docx,2015,Adelanto de fondos y cesión de factura,Entre empresa y banco con intervención de apoderados,True,"nombres_apoderados, dni_apoderados, domicilio_apoderados, nombre_banco, cuit_banco, domicilio_banco, fecha_escritura, numero_escritura, numero_protocolo, nombre_notario, numero_registro_notarial, ciudad_provincia, montos_adelanto, numero_factura, vencimiento_factura",media,"El documento está incompleto (corta en la acreditación de apoderados). Requiere revisión de toda la parte dispositiva, cláusulas de cesión, garantías y firma de partes.",si
CESION BCO.PATAGONIA-CONST. MITRE,2017 - ADELANTO DE FONDOS Y CESION DE CERT. - CONSTRUCTORA MITRE - BCO. PATAGONIA (SUC. LUJAN) MARZO 2017.docx,C:\Users\Florencia Martinez\Downloads\ESCRIBANIA-20251111T135947Z-1-001\ESCRIBANIA\CESION BCO.PATAGONIA-CONST. MITRE\2017 - ADELANTO DE FONDOS Y CESION DE CERT. - CONSTRUCTORA MITRE - BCO. PATAGONIA (SUC. LUJAN) MARZO 2017.docx,sin_fecha,Cesión de derechos de cobro,Adelanto de fondos sobre certificados de obras,True,"nombre_cedente, dni_cedente, fecha_nacimiento_cedente, estado_civil_cedente, domicilio_cedente, nombre_cesionario, dni_cesionario, razon_social_banco, cuit_banco, fecha_escritura, numero_escritura, provincia, notario_nombre, registro_notarial",media,Documento vigente conforme CCyC (art. 306). Falta completar párrafo final sobre los antecedentes societarios (truncado). Verificar correcta identificación de representantes y poder otorgado al banco para actuar.,si
CESION BCO.PATAGONIA-ENVICONTROL,ADELANTO ENVIROCONTROL S.A. -BCO. PATAGONIA(Facturas) (MARZO 2014) SUC. LUJAN (VALERI-COZZOLINO) ANTE PAULA.docx,C:\Users\Florencia Martinez\Downloads\ESCRIBANIA-20251111T135947Z-1-001\ESCRIBANIA\CESION BCO.PATAGONIA-ENVICONTROL\ADELANTO ENVIROCONTROL S.A. -BCO. PATAGONIA(Facturas) (MARZO 2014) SUC. LUJAN (VALERI-COZZOLINO) ANTE PAULA.docx,sin_fecha,Adelanto de fondos y cesión de factura,Financiamiento con cesión de derechos crediticios,False,"nombre_notario, numero_protocolo, fecha_acto, nombre_apoderado_1, dni_apoderado_1, nombre_apoderado_2, dni_apoderado_2, domicilio_apoderados, nombre_apoderado_3, dni_apoderado_3, domicilio_apoderado_3, nombre_banco, cuit_banco, fecha_fusión, escribano_fusión, numero_inscripcion_igj_fusión, fecha_cambio_denominacion, numero_inscripcion_igj_denominacion, fecha_modificacion_estatuto, numero_inscripcion_igj_estatuto",baja,"Documento redactado bajo Código Civil de Vélez (1869), no utiliza referencias al CCyC 2015. El acto se encuentra incompleto (corta abruptamente en párrafo final sobre poderes) y requiere revisión integral para actualización normativa.",no
CESION BCO.PATAGONIA-MAGMA,NOTA AUTORIZAR PAGO HONORARIOS (MAGMA) (SEPT. 2017).docx,C:\Users\Florencia Martinez\Downloads\ESCRIBANIA-20251111T135947Z-1-001\ESCRIBANIA\CESION BCO.PATAGONIA-MAGMA\NOTA AUTORIZAR PAGO HONORARIOS (MAGMA) (SEPT. 2017).docx,2017,Autorización de débito bancario,Para pago de honorarios notariales,True,"fecha_documento, nombre_banco, sucursal_banco, numero_cuenta_corriente, nombre_empresa, domicilio_empresa, departamento, provincia, cuit_empresa, numero_factura, fecha_factura, monto_factura, tipo_cuenta_acreedor, nombre_escribano, numero_cuenta_acreedor, firma_autorizante, aclaracion_firma, caracter_firmante",media,El documento mezcla formato de carta comercial con acto notarial sin claridad sobre su naturaleza jurídica. Presenta inconsistencia: factura de 2017 pero solicitud de 2025 (verificar vigencia de deuda y plazos de prescripción).,si
CESION BCO.PATAGONIA-MAREF,NOTIYPF-MAREF  (3-10-2017) FACTURA.docx,C:\Users\Florencia Martinez\Downloads\ESCRIBANIA-20251111T135947Z-1-001\ESCRIBANIA\CESION BCO.PATAGONIA-MAREF\NOTIYPF-MAREF  (3-10-2017) FACTURA.docx,sin_fecha,Notificación de Cesión de Factura,con adelanto de fondos y constitución de prenda,True,"fecha_acta, hora_acta, domicilio_notificado, nombre_representante, dni_representante, numero_factura, fecha_factura, concepto_factura, fecha_recepcion, monto_factura, moneda, numero_escritura_cesion, fecha_escritura_cesion, fojas_protocolo, registro_numero, nombre_banco_cesionario, cuit_banco, domicilio_banco, nombre_deudor_cedente, cuit_deudor, domicilio_deudor, nombre_tercero_notificado, cuit_tercero",media,"El documento está incompleto (corte en la última línea) y contiene lenguaje híbrido entre Código Vélez y CCyC. Necesita: completar texto faltante, actualizar referencias a derechos reales de prenda conforme arts. 2208-2236 CCyC, y revisar redacción de reservas de derechos del deudor original.",si
CESION BCO.PATAGONIA-MEDIOS S.A. Y OTROS,NOTA AUTORIZAR PAGO HONORARIOS - MEDIOS (MAYO 2016).docx,C:\Users\Florencia Martinez\Downloads\ESCRIBANIA-20251111T135947Z-1-001\ESCRIBANIA\CESION BCO.PATAGONIA-MEDIOS S.A. Y OTROS\NOTA AUTORIZAR PAGO HONORARIOS - MEDIOS (MAYO 2016).docx,2016,Autorización de débito bancario,para pago de honorarios de escribano,True,"nombre_banco, sucursal_banco, numero_cuenta_deudora, titular_cuenta, cuit_empresa, domicilio_empresa, numero_factura, fecha_factura, monto_pago, nombre_escribano, cuenta_corriente_escribano, fecha_documento, localidad, provincia",media,"Documento funcional pero con inconsistencias: la factura es de 2016 pero se presenta en 2025 (posible error de datos). Faltan datos del firmante (DNI, carácter/condición del que autoriza). Se recomienda verificar vigencia de la factura y aclarar si es autorización permanente o única.",si
CESION BCO.PATAGONIA-METAL 1 S.A,TESTIMONIO-CESION METAL 1-BCO.PATAGONIA.docx,C:\Users\Florencia Martinez\Downloads\ESCRIBANIA-20251111T135947Z-1-001\ESCRIBANIA\CESION BCO.PATAGONIA-METAL 1 S.A\TESTIMONIO-CESION METAL 1-BCO.PATAGONIA.docx,sin_fecha,Cesión de derechos,cesión de derechos por deuda,False,"nombres_comparecientes, dni_comparecientes, domicilios, denominacion_banco, cuit_banco, denominacion_deudor, cuit_deudor, numero_escritura, fecha_escritura, numero_poder_especial, fecha_poder_especial, numero_constitucion_social, fecha_constitucion_social",baja,"Documento incompleto (corte abrupto en párrafo final), redacción arcaica anterior a CCyC 2015 (Código de Vélez). Requiere actualización de lenguaje, referencias al CCyC arts. 267-275, y completación de cláusulas esenciales sobre objeto de la cesión, efectos y garantías.",no
CESION BCO.PATAGONIA-MYA TEC. QUIRURG,PERSONERÍA MY T TECNOLOGIA QUIRURGICA.docx,C:\Users\Florencia Martinez\Downloads\ESCRIBANIA-20251111T135947Z-1-001\ESCRIBANIA\CESION BCO.PATAGONIA-MYA TEC. QUIRURG\PERSONERÍA MY T TECNOLOGIA QUIRURGICA.docx,sin_fecha,Hipoteca,Constitución de hipoteca con representación,True,"nombre_hipotecante_1, dni_hipotecante_1, cuil_hipotecante_1, estado_civil_hipotecante_1, nombre_hipotecante_2, dni_hipotecante_2, cuil_hipotecante_2, estado_civil_hipotecante_2, domicilio_hipotecantes, localidad, provincia, nombre_deudor, cuit_deudor, domicilio_deudor, numero_poder, fecha_poder, escribana, fojas_poder, registro_notarial, numero_inscripcion_mandatos, fojas_inscripcion, tomo_inscripcion",media,"El documento es válido conforme CCyC pero contiene redundancias en la identificación de partes (se repiten dos veces los mismos datos). Falta información sobre el bien hipotecado, monto del crédito y plazo.",si
CESION BCO.PATAGONIA-NEXOR CUYO-CAPSA UTE,NEXOR CUYO CAPSA UTE-BCO. PATAGONIA(Adelanto de Fondos y Cesion de certificado) (NOV. 2013) MARTINEZ-ESTEBAN.docx,C:\Users\Florencia Martinez\Downloads\ESCRIBANIA-20251111T135947Z-1-001\ESCRIBANIA\CESION BCO.PATAGONIA-NEXOR CUYO-CAPSA UTE\NEXOR CUYO CAPSA UTE-BCO. PATAGONIA(Adelanto de Fondos y Cesion de certificado) (NOV. 2013) MARTINEZ-ESTEBAN.docx,sin_fecha,Adelanto de fondos y cesión de certificado,Operación comercial entre empresas constructoras y banco,False,"nombres_representantes, dni_representantes, estado_civil, domicilios, nombre_empresa_cedente, nombre_banco, cuit, fecha_acto, numero_escritura, protocolo, notario, registro_notarial, datos_fusion_bancaria, fechas_inscripciones_igj",baja,"Documento de 2013 utiliza referencias del Código Civil de Vélez Sársfield (art. 1.002); requiere actualización integral a normativa CCyC 2015 en identificación de partes, representación y requisitos formales. Documento incompleto (cortado al final).",no
CESION BCO.PATAGONIA-R.G.ING,CESION BCO. PATAGONIA-RG ING. Y COMPUTACION SRL(Adelanto de Fondos y Facturas)JUNIO 2011.docx,C:\Users\Florencia Martinez\Downloads\ESCRIBANIA-20251111T135947Z-1-001\ESCRIBANIA\CESION BCO.PATAGONIA-R.G.ING\CESION BCO. PATAGONIA-RG ING. Y COMPUTACION SRL(Adelanto de Fondos y Facturas)JUNIO 2011.docx,sin_fecha,Adelanto de fondos y cesión de factura,Entre empresa y banco,False,"nombres_comparecientes, numeros_dni, domicilios, razon_social_empresa, cuit_empresa, cuit_banco, numero_escritura, fecha_otorgamiento, numero_poder_especial, fecha_poder, escribano_autorizante, registro_notarial, monto_adelanto, numero_factura, fecha_factura, plazo_reembolso",baja,"Documento redactado bajo Código Civil de Vélez (referencias al art. 1.002), incompleto (corte abrupto al final). Requiere adecuación al CCyC 2015 en estructura, terminología y cláusulas sustantivas.",no
CESION BCO.PATAGONIA-REDCORDOBA,2018 - NOTIYPF-RED CORDOBA (AGSOTO 2018) FACTURAS.docx,C:\Users\Florencia Martinez\Downloads\ESCRIBANIA-20251111T135947Z-1-001\ESCRIBANIA\CESION BCO.PATAGONIA-REDCORDOBA\2018 - NOTIYPF-RED CORDOBA (AGSOTO 2018) FACTURAS.docx,2018,Notificación de Cesión de Facturas,Notificación de cesión de créditos (facturas comerciales),True,"fecha_notificacion, lugar_notificacion, nombre_receptor, dni_receptor, domicilio_receptor, nombre_cedente, cuit_cedente, domicilio_cedente, nombre_cesionario, cuit_cesionario, domicilio_cesionario, numero_escritura_cesion, fecha_escritura_cesion, fojas_protocolo, numero_registro, numero_factura_1, fecha_factura_1, monto_factura_1, numero_factura_2, fecha_factura_2, monto_factura_2, numero_factura_3, fecha_factura_3, monto_factura_3, numero_factura_4, fecha_factura_4, monto_factura_4, monto_total_cedido",media,El documento está incompleto (se corta abruptamente en la cláusula de reserva de derechos). Requiere completar la redacción final y verificar que las referencias a la escritura de cesión previa sean precisas conforme arts. 1444-1452 CCyC (cesión de créditos).,si
CESION BCO.PATAGONIA-SERV. PINSAN,NOTA AUTORIZAR PAGO HONORARIOS (SERV. PINSAN) NOV. 2017).docx,C:\Users\Florencia Martinez\Downloads\ESCRIBANIA-20251111T135947Z-1-001\ESCRIBANIA\CESION BCO.PATAGONIA-SERV. PINSAN\NOTA AUTORIZAR PAGO HONORARIOS (SERV. PINSAN) NOV. 2017).docx,2018,Autorización de débito bancario,Para pago de honorarios escribanía,True,"fecha_documento, nombre_banco, sucursal_banco, numero_cuenta_corriente, nombre_empresa, domicilio_empresa, distrito, departamento, provincia, cuit_empresa, numero_factura, fecha_factura, monto_pago, nombre_escribano, numero_caja_ahorro",media,"Contiene errores de tipeo ('Mendo' por 'Mendoza') y factura con fecha antigua (2018) que generaría dudas sobre prescripción. Faltan espacios de firma, aclaración y carácter del firmante. Revisar datos bancarios antes de usar.",si
CESION BCO.PATAGONIA-SERVICIOS CHIVAS SA,CESION_SERVICIOS CHIVAS SA-BCO. PATAGONIA(Adelanto de Fondos y Facturas (MAYO 2013)SUC. LUJAN.docx,C:\Users\Florencia Martinez\Downloads\ESCRIBANIA-20251111T135947Z-1-001\ESCRIBANIA\CESION BCO.PATAGONIA-SERVICIOS CHIVAS SA\CESION_SERVICIOS CHIVAS SA-BCO. PATAGONIA(Adelanto de Fondos y Facturas (MAYO 2013)SUC. LUJAN.docx,sin_fecha,Adelanto de fondos y cesión de factura,Servicios comerciales - Operación bancaria,False,"nombres_apoderados, dni_apoderados, estado_civil_apoderados, domicilio_apoderados, razon_social_banco, cuit_banco, fecha_escritura, numero_escritura, protocolo_notario, nombre_notario, numero_registro_notario, ciudad_provincia, referencias_escrituras_previas, numero_folio_registro, inspector_general_justicia",media,Documento anterior al CCyC 2015 (2013). Requiere actualización de referencias legales al artículo 1002 inciso c) del CCyC vigente; revisar que el poder especial cumpla con requisitos actuales del código.,no
CESION BCO.PATAGONIA-TECNASIG SRL,Instrucción de transferencia interna (WYNNE )NOV. 2014.docx,C:\Users\Florencia Martinez\Downloads\ESCRIBANIA-20251111T135947Z-1-001\ESCRIBANIA\CESION BCO.PATAGONIA-TECNASIG SRL\Instrucción de transferencia interna (WYNNE )NOV. 2014.docx,sin_fecha,Instrucción de transferencia interna,Transferencia bancaria entre cuentas,False,"fecha, nombre_banco, sucursal_banco, monto_transferencia, titular_cuenta_origen, sucursal_origen, tipo_cuenta_origen, numero_cuenta_origen, subcuenta_origen, titular_cuenta_destino, sucursal_destino, tipo_cuenta_destino, numero_cuenta_destino, subcuenta_destino, nombre_firmante, carácter_firmante, tipo_documento, numero_documento",baja,Documento anterior a CCyC 2015 (fechado noviembre 2014). Lenguaje y estructura desfasados; no es un acto notarial sino una instrucción administrativa bancaria. No debe utilizarse como plantilla en materia notarial.,no
CESION BCO.PATAGONIA-ULTIMA MILLA,Instrucción de transferencia interna (ULTIMA MILLA) NOV. 2015.docx,C:\Users\Florencia Martinez\Downloads\ESCRIBANIA-20251111T135947Z-1-001\ESCRIBANIA\CESION BCO.PATAGONIA-ULTIMA MILLA\Instrucción de transferencia interna (ULTIMA MILLA) NOV. 2015.docx,sin_fecha,Instrucción de transferencia bancaria,Transferencia interna entre cuentas,False,"fecha, nombre_banco, numero_sucursal, monto_transferencia, titular_cuenta_origen, sucursal_origen, tipo_cuenta_origen, numero_cuenta_origen, subcuenta_origen, titular_cuenta_destino, sucursal_destino, tipo_cuenta_destino, numero_cuenta_destino, subcuenta_destino, nombre_solicitante, caracter_solicitante, tipo_documento, numero_documento",baja,"Este no es un acto notarial sino un documento bancario administrativo. Carece de requisitos esenciales de actos notariales (protocolo, número de acta, intervención de escribano, autenticación).",no
CESION BCO.PATAGONIA-WYNNE,WYNNE INDUSTRIAL SRL-BCO. PATAGONIA(Adelanto de Fondos y Cesion de certificado) (OCT. 2013) IPV - COZZOLINO-ORIOLANI.docx,C:\Users\Florencia Martinez\Downloads\ESCRIBANIA-20251111T135947Z-1-001\ESCRIBANIA\CESION BCO.PATAGONIA-WYNNE\WYNNE INDUSTRIAL SRL-BCO. PATAGONIA(Adelanto de Fondos y Cesion de certificado) (OCT. 2013) IPV - COZZOLINO-ORIOLANI.docx,sin_fecha,Adelanto de fondos y cesión de certificado,Entre empresa y banco,False,"nombres_apoderados, DNI_apoderados, domicilio_apoderados, razon_social_empresa, nombre_banco, CUIT_banco, fecha_otorgamiento, numero_escritura, ciudad_notaria, numero_registro_notario, datos_poder_especial, datos_fusion_bancaria",baja,"Documento de 2013 redactado conforme Código Civil de Vélez. Requiere actualización integral a lenguaje y estructura del CCyC 2015 (capacidad, representación, obligaciones). Texto incompleto al final (corte abrupto).",no
CESION BNA - BRIZUELA Y VILLAFAÑE,RESOLUCION  DE  SOLICITUDES  DE  PRÉSTAMOS.docx,C:\Users\Florencia Martinez\Downloads\ESCRIBANIA-20251111T135947Z-1-001\ESCRIBANIA\CESION BNA - BRIZUELA Y VILLAFAÑE\RESOLUCION  DE  SOLICITUDES  DE  PRÉSTAMOS.docx,2021,Resolución de Préstamo - Cesión de Créditos,Descuento de Certificado de Obra con garantía de Certificado de Obra público,True,"nombre_empresa, legajo_unico, cuenta_corriente, importe_prestamo, fecha_resolucion, numero_certificado_obra, fecha_certificado, fecha_contrato_locacion, municipalidad, descripcion_obra, numero_expediente_municipal, numero_licitacion, numero_decreto, monto_certificado_garantia, plazo_dias, fecha_vencimiento_operacion, porcentaje_financiamiento, cuenta_corriente_debitos",baja,"Documento administrativo-bancario de uso interno, NO es un acto notarial. Carece de solemnidades requeridas (firma de escribano, comparecencia de partes, protocolo). Mezcla normas del CCyC con régimen especial de obras públicas (Ley 4.416) sin instrumentación notarial clara.",no
