carpeta,archivo,ruta,anio,tipo_acto,subtipo,vigente_ccyc,variables_detectadas,calidad_preset,observaciones,usar_como_preset
CONTRATOS,CONVENIO MARCO - 14-01-21.docx,C:\Users\Florencia Martinez\Downloads\ESCRIBANIA-20251111T135947Z-1-001\ESCRIBANIA\CONTRATOS\CONVENIO MARCO - 14-01-21.docx,2021,Convenio Marco / Acuerdo de Asociación,Constitución de Sociedad por Acciones Simplificada (SAS) con aporte de capital e intangibles,True,"nombre_emprendedor, dni_emprendedor, cuit_emprendedor, fecha_nacimiento_emprendedor, domicilio_emprendedor, email_emprendedor, nombre_inversor, dni_inversor, cuit_inversor, fecha_nacimiento_inversor, domicilio_inversor, email_inversor, fecha_acto, ciudad, nombre_plataforma, url_plataforma, capital_inicial_sociedad, porcentaje_dinero_efectivo, monto_aporte_inversor, plazo_aporte_meses, participacion_accionaria_emprendedor, participacion_accionaria_inversor, provincia_domicilio_sociedad",media,"El documento está incompleto (se corta en la cláusula SEGUNDO). Requiere revisión de cláusulas esenciales: régimen de responsabilidad, distribución de ganancias, mecanismo de integración de aportes, cláusulas de salida/disolución, y firma de partes e interventor notarial.",si
CONTRATOS DE COMPRAVENTA,2020 - Boleto de compra venta lote ROZO - MUNAFO (20 NOV. 2020).docx,C:\Users\Florencia Martinez\Downloads\ESCRIBANIA-20251111T135947Z-1-001\ESCRIBANIA\CONTRATOS DE COMPRAVENTA\2020 - Boleto de compra venta lote ROZO - MUNAFO (20 NOV. 2020).docx,2020,Compraventa de inmueble,de lote de terreno urbano,True,"nombre_vendedor, dni_vendedor, fecha_nacimiento_vendedor, nombre_conyuge, dni_conyuge, domicilio_vendedor, nombre_compradora, dni_compradora, domicilio_compradora, descripcion_inmueble, ubicacion_inmueble, lote_numero, manzana_numero, superficie_titulo_i, matricula_titulo_i, superficie_titulo_ii, matricula_titulo_ii, superficie_mensura, numero_plano_mensura, fecha_mensura, agrimensor, numero_catastro, nomenclatura_catastral, padron_territorial, padron_municipal, avaluo_fiscal_año, avaluo_fiscal_monto, propietario_registral, cuit_propietario, fecha_cesion_derechos, cedente_anterior",media,"Documento vigente en CCyC pero incompleto: falta especificar precio de venta, forma de pago, cláusulas de entrega, condiciones precedentes y datos del escribano actuante. Requiere completar el acto.",si
CONVENCION PREMATRIMONIAL,CONVENCION PREMATRIMONIAL (SEPARACION DE BIENES) PEREZ-BONACORSO (MAYO 2016).docx,C:\Users\Florencia Martinez\Downloads\ESCRIBANIA-20251111T135947Z-1-001\ESCRIBANIA\CONVENCION PREMATRIMONIAL\CONVENCION PREMATRIMONIAL (SEPARACION DE BIENES) PEREZ-BONACORSO (MAYO 2016).docx,sin_fecha,Convención prematrimonial,Opción de régimen de separación de bienes,True,"nombre_compareciente_1, dni_1, cuit_1, fecha_nacimiento_1, estado_civil_1, domicilio_1, nombre_compareciente_2, dni_2, cuit_2, fecha_nacimiento_2, estado_civil_2, domicilio_2, fecha_matrimonio_previsto, descripcion_bienes_compareciente_1, descripcion_bienes_compareciente_2, marca_modelo_vehiculo, dominio_vehiculo, chasis_vehiculo, ubicacion_inmueble, superficie_inmueble, numero_catastro",media,El documento está incompleto: corta abruptamente en la descripción del inmueble de la compareciente 2 (falta completar 'VEINTISEI...'). Requiere revisión de ortografía ('esta civil' por 'de estado civil') y debe completarse la enumeración de bienes antes de usarse como preset.,si
CONVENIO DE DESOCUPACION,CONVENIO DE DESOCUPACION-RUBIO.docx,C:\Users\Florencia Martinez\Downloads\ESCRIBANIA-20251111T135947Z-1-001\ESCRIBANIA\CONVENIO DE DESOCUPACION\CONVENIO DE DESOCUPACION-RUBIO.docx,sin_fecha,Convenio de Desocupación,Inmueble urbano destinado a vivienda y local comercial,False,"nombre_propietario, documento_propietario, domicilio_propietario, nombre_ocupante, documento_ocupante, domicilio_ocupante, ubicacion_inmueble, fecha_desocupacion, hora_constatacion, descripcion_bienes_inmuebles, monto_multa_diaria, jurisdiccion_judicial, fecha_firma",baja,"El documento utiliza referencias al Código Civil de Vélez (art. 509) y lenguaje anterior al CCyC 2015. Requiere actualización a normativa vigente: reemplazar referencias por art. 887 y ss. del CCyC, revisar cláusulas de mora y penalidades conforme nuevo régimen, y ajustar terminología a estándares actuales (ej: 'DNI' por 'Cédula de identidad').",no
CONVENIO SEÑA,2019 - RESERVA MOYA - BASILIO (MARZO 2019).docx,C:\Users\Florencia Martinez\Downloads\ESCRIBANIA-20251111T135947Z-1-001\ESCRIBANIA\CONVENIO SEÑA\2019 - RESERVA MOYA - BASILIO (MARZO 2019).docx,2019,Contrato de Reserva de Compra de Inmueble,de dos inmuebles urbanos con representación,True,"nombre_representante, dni_representante, domicilio_representante, nombre_representado, dni_representado, cuil_representado, fecha_nacimiento_representado, estado_familia_representado, domicilio_representado, nombre_comprador, dni_comprador, cuit_comprador, fecha_nacimiento_comprador, estado_familia_comprador, domicilio_comprador, descripcion_inmueble_1, superficie_inmueble_1, limites_inmueble_1, matricula_inmueble_1, nomenclatura_catastral_1, padron_territorial_1, padron_municipal_1, descripcion_inmueble_2, precio_total, seña_reserva, plazo_vencimiento",media,"El documento está incompleto (finaliza abruptamente en la descripción del segundo inmueble). Requiere completar todas las cláusulas de condiciones, precio, seña, plazo, rescisión y disposiciones finales conforme al CCyC 2015.",si
CONVENIOS VARIOS,CONVENIO MARCO - Alejandro Bonanno y Mario Aguilera.docx,C:\Users\Florencia Martinez\Downloads\ESCRIBANIA-20251111T135947Z-1-001\ESCRIBANIA\CONVENIOS VARIOS\CONVENIO MARCO - Alejandro Bonanno y Mario Aguilera.docx,2021,Convenio Marco o Acuerdo de Asociación,Preconstitutivo de Sociedad por Acciones Simplificada (SAS),True,"nombre_emprendedor, dni_emprendedor, cuit_emprendedor, fecha_nacimiento_emprendedor, domicilio_real_emprendedor, email_emprendedor, nombre_inversor, dni_inversor, cuit_inversor, fecha_nacimiento_inversor, domicilio_real_inversor, email_inversor, fecha_documento, localidad, dominio_web, capital_inicial_sociedad, porcentaje_integracion_inicial, aporte_inversor_total, plazo_integracion_meses, porcentaje_participacion_emprendedor, denominacion_plataforma",media,"El documento está incompleto (corta abruptamente en la cláusula SEGUNDO). Requiere revisión de consistencia entre montos, porcentajes de participación accionaria y condiciones de integración de capital según CCyC arts. 141-153 (sociedades comerciales).",si
CUIT-CUIL,Cuit TRuchex.docx,C:\Users\Florencia Martinez\Downloads\ESCRIBANIA-20251111T135947Z-1-001\ESCRIBANIA\CUIT-CUIL\Cuit TRuchex.docx,sin_fecha,ERROR,,,,,No se pudo leer el archivo,no
DACION EN PAGO,DACION EN PAGO DALVIAN (SEPT. 2013) ANTE AMR.docx,C:\Users\Florencia Martinez\Downloads\ESCRIBANIA-20251111T135947Z-1-001\ESCRIBANIA\DACION EN PAGO\DACION EN PAGO DALVIAN (SEPT. 2013) ANTE AMR.docx,2015,Dación en pago,de inmueble urbano en extinción de deuda,False,"nombre_acreedor, dni_acreedor, cuit_acreedor, domicilio_acreedor, nombre_deudor, dni_deudor, cuit_deudor, domicilio_deudor, razon_social_empresa, cuit_empresa, domicilio_empresa, numero_apoderado, fecha_escritura_constitucion, numero_poder_especial, fecha_poder_especial, descripcion_inmueble, ubicacion_inmueble, monto_deuda, concepto_deuda",media,Documento redactado bajo Código Civil de Vélez Sarsfield (referencias a art. 1.002). Requiere actualización a lenguaje CCyC 2015 para vigencia actual. El acto se encuentra incompleto (corte en la descripción del inmueble).,no
DALVIAN  - ECOGAS,2022 - CERTIFICACION DE TITULOS SECTOR IV - PARA DALVIAN (ECOGAS JULIO 2022.docx,C:\Users\Florencia Martinez\Downloads\ESCRIBANIA-20251111T135947Z-1-001\ESCRIBANIA\DALVIAN  - ECOGAS\2022 - CERTIFICACION DE TITULOS SECTOR IV - PARA DALVIAN (ECOGAS JULIO 2022.docx,sin_fecha,Certificación notarial de estudio de títulos,Verificación de cobertura de superficie - Conjunto residencial,True,"nombre_notario, registro_notarial, nombre_conjunto_residencial, nombre_agrimensor, numero_plano_catastro, titulo_numero, asiento_registral, fojas_tomo, matricula, superficie_hectareas_metros, nombre_solicitante, entidades_presentacion, fecha_documento, ciudad",alta,"Documento conforme a estándares del CCyC. Certificación clara y completa con identificación de títulos, referencias catastrales y conclusión explícita. Apto para uso como preset de certificación de cobertura de superficies.",si
DALVIAN - CUENTA DE ENERO 2013 - DIC. 2014 - 2015 - 2016,EST_LUZ DE LUNA (JUNIO 2015).docx,C:\Users\Florencia Martinez\Downloads\ESCRIBANIA-20251111T135947Z-1-001\ESCRIBANIA\DALVIAN - CUENTA DE ENERO 2013 - DIC. 2014 - 2015 - 2016\EST_LUZ DE LUNA (JUNIO 2015).docx,sin_fecha,Estudio de Títulos,Certificación de cadena dominial de inmueble,False,"nombre_propietario, cuit_propietario, domicilio_propietario, ubicacion_inmueble, superficie_titulo, superficie_catastro, limites_perimetrales, nombre_vendedor, numero_escritura_compra, fecha_escritura_compra, nombre_notario_compra, registro_notarial_compra, asiento_registral, matricula_folio_real, nombre_transferente_anterior, numero_escritura_transferencia, fecha_escritura_transferencia, nombre_notario_transferencia, registro_notarial_transferencia, fecha_estudio",media,"Documento redactado conforme normativa anterior al CCyC 2015; utiliza lenguaje y formato del Código de Vélez. Requiere actualización a lenguaje y referencias del CCyC vigente, especialmente en descripciones de actos jurídicos y derechos reales.",no
DALVIAN - CUENTA HISTORICA (A DIC. 2012),PRESUPUESTO PODER VERA Y OTROS A RODRIGUEZ (ESC. 93) 2012.docx,C:\Users\Florencia Martinez\Downloads\ESCRIBANIA-20251111T135947Z-1-001\ESCRIBANIA\DALVIAN - CUENTA HISTORICA (A DIC. 2012)\PRESUPUESTO PODER VERA Y OTROS A RODRIGUEZ (ESC. 93) 2012.docx,sin_fecha,Poder especial,,False,"fecha, número_escritura, escriptorio, monto_honorarios, monto_iva, monto_inscripcion, monto_aportes",baja,"Documento incompleto: solo contiene estructura arancelaria sin el acto notarial propiamente dicho (otorgante, apoderado, facultades conferidas). Requiere incorporación del acto completo conforme CCyC 2015 para ser usable como preset.",no
DALVIAN SA- DHSA - FUSION (2016-2021),2017 -DALVIAN HOUSE- DALVIAN  (2017) LOTES 1-2-3-4 BALCONES (MAYO 2017).docx,C:\Users\Florencia Martinez\Downloads\ESCRIBANIA-20251111T135947Z-1-001\ESCRIBANIA\DALVIAN SA- DHSA - FUSION (2016-2021)\2017 -DALVIAN HOUSE- DALVIAN  (2017) LOTES 1-2-3-4 BALCONES (MAYO 2017).docx,2017,Transferencia de dominio por fusión por absorción,Parcial - De Dalvian House S.A. (absorbida) a Dalvian S.A. (absorbente),True,"número_escritura, fecha_día, fecha_mes_año, notario_nombre, notario_registro, compareciente_nombre, compareciente_dni, compareciente_fecha_nacimiento, compareciente_domicilio, sociedad_absorbente_nombre, sociedad_absorbente_domicilio, sociedad_absorbente_cuit, sociedad_absorbente_cargo, sociedad_constitucion_escritura_número, sociedad_constitucion_fecha, escribano_original_nombre, inmueble_descripción, acuerdo_fusión_escritura_número, acuerdo_fusión_fecha, acta_complementaria_escritura_número, acta_complementaria_fecha, resolución_personas_jurídicas_números, resolución_fecha, expediente_número",media,"El documento está incompleto (se corta en el apartado I.1), pero usa correctamente el CCyC 2015 (art. 306). Requiere completar la parte dispositiva y firmas notariales.",si
DALVIAN-OCTUBRE 2009,UNIFICACION-DACION EN PAGO DALVIAN S.A.-DALVIAN HOUSE plano 39439-2 (ESC. 261).docx,C:\Users\Florencia Martinez\Downloads\ESCRIBANIA-20251111T135947Z-1-001\ESCRIBANIA\DALVIAN-OCTUBRE 2009\UNIFICACION-DACION EN PAGO DALVIAN S.A.-DALVIAN HOUSE plano 39439-2 (ESC. 261).docx,sin_fecha,Dación en pago,Unificación de deudas entre sociedades anónimas,False,"número_escritura, fecha_otorgamiento, notario_nombre, registro_notarial, compareciente_1_nombre, compareciente_1_documento, compareciente_1_domicilio, compareciente_2_nombre, compareciente_2_documento, compareciente_2_domicilio, sociedad_1_nombre, sociedad_1_cuit, sociedad_1_domicilio, poder_1_numero, poder_1_fecha, poder_1_escribano, poder_1_registro, sociedad_2_nombre, sociedad_2_cuit, sociedad_2_domicilio, poder_2_numero, poder_2_fecha, poder_2_registro",baja,"Documento incompleto (se corta en la narración del acto). Utiliza referencias al Código Civil de Vélez (art. 1.202) y terminología obsoleta (Libreta de Enrolamiento, vecino). Requiere actualización al CCyC 2015 y completitud del texto.",no
DECLARACION JDA. DOMICILIO,DECLARACION JURAD RODRIGUEZ.docx,C:\Users\Florencia Martinez\Downloads\ESCRIBANIA-20251111T135947Z-1-001\ESCRIBANIA\DECLARACION JDA. DOMICILIO\DECLARACION JURAD RODRIGUEZ.docx,sin_fecha,Declaración Jurada de Domicilio y Bien Propio,Vehículo - Régimen patrimonial matrimonial,False,"fecha_otorgamiento, ciudad_provincia, notario_nombre, registro_notarial, compareciente_1_nombre, compareciente_1_nacionalidad, compareciente_1_dni, compareciente_1_estado_civil, compareciente_2_nombre, compareciente_2_nacionalidad, compareciente_2_dni, domicilio, vehiculo_marca, vehiculo_modelo, vehiculo_motor, vehiculo_chasis, vehiculo_patente, fuente_fondos",baja,"El documento utiliza referencias al Código Civil de Vélez (art. 1.002) y lenguaje pre-CCyC 2015; requiere actualización integral a normativa vigente (arts. 72-87 CCyC para capacidad, arts. 460-472 para regímenes matrimoniales). La mención a 'sociedad conyugal' debe adecuarse al régimen de 'comunidad de ganancias' del CCyC.",no
DECLARACION JURADA-VARIAS,DELCARACION JURADA MUNICIPALIDAD.docx,C:\Users\Florencia Martinez\Downloads\ESCRIBANIA-20251111T135947Z-1-001\ESCRIBANIA\DECLARACION JURADA-VARIAS\DELCARACION JURADA MUNICIPALIDAD.docx,sin_fecha,Declaración de Superficie y Transferencia de Inmueble,Acto administrativo municipal con intervención de partes,False,"fecha_documento, nombre_transmitente, dni_transmitente, nombre_adquirente, dni_adquirente, numero_padron_municipal, ubicacion_calle, numero_calle, distrito, departamento, provincia, fecha_declaracion_superficie, superficie_cubierta_m2, deudas_posteriores",baja,"Documento redactado bajo normas anteriores al CCyC 2015; utiliza lenguaje y estructura obsoletos. Requiere actualización integral de formato, cláusulas y terminología para cumplir con estándares actuales del Código Civil y Comercial.",no
DESISTIMIENTO,NOTA DESISTIMIENTO REGISTRO.docx,C:\Users\Florencia Martinez\Downloads\ESCRIBANIA-20251111T135947Z-1-001\ESCRIBANIA\DESISTIMIENTO\NOTA DESISTIMIENTO REGISTRO.docx,sin_fecha,Desistimiento de inscripción notarial,De escritura pública de registro,False,"nombre_notario, numero_registro_notarial, numero_escritura, numero_entrada, fecha_escritura, fojas, fecha_desistimiento, provincia",baja,Documento anterior a CCyC (2010). Requiere actualización a lenguaje y estructura vigente del CCyC 2015 con referencias a los artículos aplicables de capacidad y consentimiento.,no
DISTRACTO,DISTRACTO-DALVIAN HOUSE Y DALVIAN SA (2011).docx,C:\Users\Florencia Martinez\Downloads\ESCRIBANIA-20251111T135947Z-1-001\ESCRIBANIA\DISTRACTO\DISTRACTO-DALVIAN HOUSE Y DALVIAN SA (2011).docx,sin_fecha,Distracto de Dación en Pago,de inmueble urbano,False,"nombre_apoderado, documento_apoderado, domicilio_apoderado, nombre_empresa_1, cuit_empresa_1, numero_poder_1, fecha_poder_1, nombre_empresa_2, cuit_empresa_2, numero_poder_2, fecha_poder_2, numero_escritura_antecedente, fecha_escritura_antecedente, ubicacion_inmueble, superficie_inmueble, limites_norte, limites_sur, limites_este, limites_oeste, matricula_inmueble",media,"Documento usa lenguaje y referencias del Código Civil de Vélez (art. 1.002), anterior al CCyC 2015. Requiere actualización a normativa vigente del CCyC (arts. 288-289 sobre representación, 1885-1898 sobre dación en pago) y modernización de formatos de individuación de bienes.",no
DIVISION DE CONDOMINIO,DIVCOND_RICCARDI_DEBETA (2005).docx,C:\Users\Florencia Martinez\Downloads\ESCRIBANIA-20251111T135947Z-1-001\ESCRIBANIA\DIVISION DE CONDOMINIO\DIVCOND_RICCARDI_DEBETA (2005).docx,sin_fecha,División de condominio,"De inmueble rural (15.562,73 m²)",False,"Nombres de condóminos, Números de DNI/LE, CUIT/L, Estado civil de comparecientes, Nombres de cónyuges, Domicilio especial, Ubicación del inmueble (distrito, departamento), Superficie del inmueble, Porcentaje de condominio, Número y fecha de escritura de origen, Nombre del notario de origen, Número de matrícula, Folio Real",baja,"Documento de 2005 usa Código Civil de Vélez (art. 1.277 en lugar de CCyC). El texto aparece incompleto al final (corte en 'b) Posteriormente, e'). Requiere actualización integral al CCyC 2015 y verificación de estado dominial.",no
DOMINIO FIDUCIARIO,DOM.FID.SUDINV_PISSIS SA(Lote15).docx,C:\Users\Florencia Martinez\Downloads\ESCRIBANIA-20251111T135947Z-1-001\ESCRIBANIA\DOMINIO FIDUCIARIO\DOM.FID.SUDINV_PISSIS SA(Lote15).docx,sin_fecha,Compraventa de inmueble,con cargos,False,"nombre_vendedor, dni_vendedor, domicilio_vendedor, nombre_comprador, dni_comprador, domicilio_comprador, nombre_tercero, fecha_nacimiento_tercero, domicilio_tercero, nombre_empresa_vendedora, cuit_empresa, domicilio_legal_empresa, numero_escritura, fecha_escritura, numero_notario, ciudad_notario, poder_numero_1, poder_fecha_1, poder_numero_2, poder_fecha_2, registro_mandatos_numero, registro_mandatos_fojas, registro_mandatos_tomo",baja,"Documento redactado bajo Código de Vélez (2006). Requiere actualización a lenguaje y estructura del CCyC 2015: capacidad jurídica, legitimación conforme arts. 335-340 CCyC, identificación de partes con art. 287 CCyC. Falta completar: descripción del inmueble, precio, forma de pago y cargos específicos.",no
DONACION,DONACION MENDOZA (DICIEMBRE 2019).docx,C:\Users\Florencia Martinez\Downloads\ESCRIBANIA-20251111T135947Z-1-001\ESCRIBANIA\DONACION\DONACION MENDOZA (DICIEMBRE 2019).docx,2019,Donación con constitución de usufructo y desafectación de vivienda familiar,De inmueble urbano con subrogación real de protección,True,"nombre_donante_1, dni_donante_1, cuit_donante_1, fecha_nac_donante_1, nombre_donante_2, dni_donante_2, cuit_donante_2, fecha_nac_donante_2, domicilio_donantes, nombre_donatario_1, dni_donatario_1, cuit_donatario_1, fecha_nac_donatario_1, estado_civil_donatario_1, domicilio_donatario_1, nombre_donatario_2, dni_donatario_2, cuit_donatario_2, fecha_nac_donatario_2, estado_civil_donatario_2, domicilio_donatario_2, nombre_donatario_3, dni_donatario_3, cuit_donatario_3, fecha_nac_donatario_3, estado_civil_donatario_3, domicilio_donatario_3, nombre_conyuge_donatario_3, dni_conyuge_donatario_3, fecha_nac_conyuge_donatario_3, numero_escritura, numero_protocolo, fecha_escritura, ciudad_escritura, notario_nombre, numero_registro_notarial, descripcion_inmuebles",media,"Documento incompleto (falta descripción de inmuebles y cláusulas finales), pero estructura correcta con referencias al CCyC 2015 (art. 306, 470). Requiere completar datos de inmuebles, montos, plazo de usufructo y firma digital notarial.",si
EDICTOS,PUBLI.EDICTOS-TERRARENA.docx,C:\Users\Florencia Martinez\Downloads\ESCRIBANIA-20251111T135947Z-1-001\ESCRIBANIA\EDICTOS\PUBLI.EDICTOS-TERRARENA.docx,sin_fecha,Acta de Constitución de Sociedad Anónima,Comunicación de constitución de S.A.,False,"nombre_sociedad, nombres_socios, dni_socios, cuit_cuil_socios, fechas_nacimiento_socios, domicilios_socios, profesiones_socios, numero_escritura_constitutiva, fecha_escritura_constitutiva, nombre_escribano, domicilio_social, objeto_social, plazo_duracion, monto_capital_social, cantidad_acciones, valor_nominal_accion, presidente_directorio, director_suplente, fecha_cierre_ejercicio",baja,"El documento usa Ley 19.550 (Código de Comercio derogado) y referencias anteriores al CCyC 2015. Requiere actualización normativa completa a la Ley 26.994 (CCyC), especialmente en materia de gobierno corporativo, responsabilidad de administradores y derechos de socios.",no
EMANCIPACION,EMANCIPACION WAISMAN.docx,C:\Users\Florencia Martinez\Downloads\ESCRIBANIA-20251111T135947Z-1-001\ESCRIBANIA\EMANCIPACION\EMANCIPACION WAISMAN.docx,sin_fecha,Habilitación de edad (emancipación),Emancipación por acto de los padres,False,"nombres_padres, dni_padre, dni_madre, nombre_hijo, dni_hijo, fecha_nacimiento_hijo, domicilio, numero_escritura, fecha_otorgamiento, registro_notarial, datos_matrimonio_padres, acta_nacimiento_hijo",baja,"Documento redactado conforme al Código Civil de Vélez (art. 131 sobre habilitación de edad), derogado por el CCyC 2015. Requiere revisión completa: el CCyC eliminó la figura de habilitación de edad, reemplazándola por emancipación (art. 643). No es aplicable en la actualidad.",no
ESCRITOS VARIOS,"SOLICITUD DESARCHIVO PEREZ, JAIME FEBRERO 2021 (1).docx","C:\Users\Florencia Martinez\Downloads\ESCRIBANIA-20251111T135947Z-1-001\ESCRIBANIA\ESCRITOS VARIOS\SOLICITUD DESARCHIVO PEREZ, JAIME FEBRERO 2021 (1).docx",sin_fecha,Solicitud de desarchivo y préstamo de autos judiciales,Para otorgamiento de escritura de transferencia de inmuebles en sucesión,False,"nombre_notario, numero_registro_notario, domicilio_notario, nombre_escribana_adscripta, nombre_escribano_adscripto, numero_registro_adscripto, numero_expediente, carátula_expediente, tribunal_competente, circunscripcion_judicial, provincia, fecha_archivacion, paquete_archivo, año_archivacion",baja,"Documento de carácter procesal/administrativo dirigido a juzgado, no es acto notarial típico. Redacción arcaica (ut supra, Usía) que requiere actualización conforme CCyC 2015.",no
ESCRITURAS ANDREA VILA Y ABOGADOS,TRASMISIÓN DE DOMINIO A TÍTULO DE CUMPLIMIENTO DE ACUERDO TRANSACCIONAL EN JUICIO POR RECOMPOSICIÓN DE PORCIÓN HEREDITARIA.docx,C:\Users\Florencia Martinez\Downloads\ESCRIBANIA-20251111T135947Z-1-001\ESCRIBANIA\ESCRITURAS ANDREA VILA Y ABOGADOS\TRASMISIÓN DE DOMINIO A TÍTULO DE CUMPLIMIENTO DE ACUERDO TRANSACCIONAL EN JUICIO POR RECOMPOSICIÓN DE PORCIÓN HEREDITARIA.docx,sin_fecha,Escritura de transmisión de dominio a título de cumplimiento de acuerdo transaccional,Por recomposición de porción hereditaria en juicio,True,"número_escritura, día_mes_año, notario_nombre, registro_notarial, nombre_compareciente_1, dni_compareciente_1, cuit_compareciente_1, fecha_nacimiento_compareciente_1, estado_civil_compareciente_1, domicilio_compareciente_1, nombre_compareciente_2, dni_compareciente_2, cuit_compareciente_2, fecha_nacimiento_compareciente_2, estado_civil_compareciente_2, cónyuge_nombre, domicilio_compareciente_2, denominacion_sociedad_1, cuit_sociedad_1, domicilio_sociedad_1, cargo_representante, fecha_contrato_social, escribana_autora, fojas_protocolo, registro_notarial_sociedad, fojas_legajo, fecha_asamblea, fecha_acta_directorio, descripcion_inmueble, monto_transaccion",media,Documento incompleto (corta abruptamente en acta de asamblea). Contiene referencias válidas al CCyC 2015 (art. 306) pero requiere completar datos faltantes y revisar la descripción del inmueble objeto de transmisión.,si
ESPINOLA,SOMETIMIENTO A PH - ESPINOLA - ADJUDICACION - ANT. DE HERENCIA (ENERO 2017).docx,C:\Users\Florencia Martinez\Downloads\ESCRIBANIA-20251111T135947Z-1-001\ESCRIBANIA\ESPINOLA\SOMETIMIENTO A PH - ESPINOLA - ADJUDICACION - ANT. DE HERENCIA (ENERO 2017).docx,sin_fecha,Anticipo de herencia con reglamento de copropiedad,Adjudicación de inmueble en condominio con división de herencia,True,"nombre_compareciente_principal, dni_compareciente, cuit_compareciente, fecha_nacimiento, estado_civil, nombre_conyuge, dni_conyuge, numero_escritura, fecha_otorgamiento, numero_protocolo, notario_nombre, registro_notarial_numero, domicilio_inmueble, distrito_seccion, porcentaje_copropiedad, numero_unidad_funcional",media,Documento incompleto en su reproducción (corta abruptamente en último compareciente). Contiene redacción adecuada al CCyC pero requiere completitud total y clarificación de los porcentajes de adjudicación hereditaria y régimen de copropiedad.,si
ESTUDIOS DE TITULOS,2021 - EST_JARA Sebastián (VENDE VILADRICH) (BNA - SUC 2400) OCT. 2021.docx,C:\Users\Florencia Martinez\Downloads\ESCRIBANIA-20251111T135947Z-1-001\ESCRIBANIA\ESTUDIOS DE TITULOS\2021 - EST_JARA Sebastián (VENDE VILADRICH) (BNA - SUC 2400) OCT. 2021.docx,2021,Estudio de títulos,de inmueble urbano con garantía hipotecaria,True,"nombre_propietario_1, dni_propietario_1, cuit_propietario_1, fecha_nacimiento_propietario_1, nombre_propietario_2, dni_propietario_2, cuit_propietario_2, fecha_nacimiento_propietario_2, fecha_union_convivencial, numero_acta_union_convivencial, fecha_acta_union_convivencial, escribana_union_convivencial, registro_escribana_union, lote_numero, calle_inmueble, barrio_inmueble, distrito_inmueble, departamento_inmueble, provincia, superficie_m2, mes_ano_mensura, agrimensor_nombre, numero_catastro, lindero_norte, medida_norte, lindero_sur, medida_sur, lindero_este, medida_este, lindero_oeste, medida_oeste, nomenclatura_catastral, padron_territorial, padron_municipal, avaluo_fiscal_ano, avaluo_fiscal_monto, vendedor_nombre, vendedor_estado_familia, banco_acreedor, sucursal_banco, numero_escritura_compra, fecha_escritura_compra, registro_notarial_acreedor, propietario_anterior_1, propietario_anterior_2, numero_escritura_anterior, fecha_escritura_anterior, escribana_anterior, fojas_protocolo_anterior, registro_notarial_anterior, numero_matricula_folio_real, asiento_registro",media,Documento incompleto (finaliza abruptamente con 'LE C'). Contiene referencias correctas al CCyC (arts. 509 ss. sobre uniones convivenciales) pero requiere completarse y revisar redacción de algunos párrafos para mayor precisión técnica.,no
